[CHECKER] Integer Over/Underflows
[CHECKER] Suicidal
[CHECKER] Re-Entrancy
[CHECKER] Improper use of Tx.origin
[CHECKER] Ether-Leaking

[INFO] all funcs : 42
[INFO] reachable : 26
[INFO] Generating Paths ... took 0.003584s
[INFO] # path : 165

[INFO] Violate CEI: false
[INFO] msg.sender = this possible: false
[INFO] Performing Interval Analysis ... took 0.015718s
Generating VCs ... took 0.275138s
Checking validity of VCs ... 
=============== Invariants Found ===============
Iter: 1 Total elapsed : 0.660506
[
-1 -> true
0 -> true
517 -> true
(-1,517) -> true
]
[
]
1/55 ... [IO] line 103, ((lockedInBets + jackpotSize) + devFeeSize) ... unproven
2/55 ... [IO] line 103, (lockedInBets + jackpotSize) ... unproven
3/55 ... [IO] line 138, (2 * amount) ... unproven
4/55 ... [IO] line 144, (amount * JACKPOT_FEE) ... unproven
5/55 ... [IO] line 144, (jackpotSize + ((amount * JACKPOT_FEE) / 1000)) ... unproven
6/55 ... [IO] line 145, (amount * DEV_FEE) ... unproven
7/55 ... [IO] line 145, (devFeeSize + ((amount * DEV_FEE) / 1000)) ... unproven
8/55 ... [IO] line 146, (amount * WIN_X) ... unproven
9/55 ... [IO] line 146, (lockedInBets + ((amount * WIN_X) / 1000)) ... unproven
10/55 ... [IO] line 148, (amount * DONATING_X) ... unproven
11/55 ... [IO] line 150, (totalAmountToWhale + donate_amount) ... unproven
12/55 ... [IO] line 176, (block.number - BET_EXPIRATION_BLOCKS) ... proven
13/55 ... [IO] line 182, (bet.amount * WIN_X) ... unproven
14/55 ... [IO] line 197, (tossWin + jackpotWin) ... unproven
15/55 ... [IO] line 199, (tossWin + jackpotWin) ... unproven
16/55 ... [IO] line 205, (lockedInBets - tossWinAmount) ... unproven
17/55 ... [IO] line 218, (donateAmount[msg.sender] + msg.value) ... unproven
18/55 ... [IO] line 228, (donateAmount[msg.sender] - amount) ... proven
19/55 ... [IO] line 239, (bet.blockNumber + BET_EXPIRATION_BLOCKS) ... unproven
20/55 ... [IO] line 252, (devFeeSize - withdrawAmount) ... proven
21/55 ... [IO] line 265, (devFeeSize - withdrawAmount) ... proven
22/55 ... [IO] line 291, ((lockedInBets + jackpotSize) + devFeeSize) ... unproven
23/55 ... [IO] line 291, (lockedInBets + jackpotSize) ... unproven
24/55 ... [IO] line 292, (((address(this).balance - lockedInBets) - jackpotSize) - devFeeSize) ... unproven
25/55 ... [IO] line 292, ((address(this).balance - lockedInBets) - jackpotSize) ... unproven
26/55 ... [IO] line 292, (address(this).balance - lockedInBets) ... unproven
27/55 ... [IO] line 320, (bet.amount * WIN_X) ... unproven
28/55 ... [IO] line 321, (lockedInBets - tossWinAmount) ... unproven
29/55 ... [IO] line 348, (i + 1) ... proven
30/55 ... [IO] line 359, (bet.blockNumber + BET_EXPIRATION_BLOCKS) ... unproven
31/55 ... [KA] line 300, selfdestruct(owner); ... unproven
32/55 ... [ETH_LEAK] line 155, whale.call.value(donate_amount)(bytes4(keccak256("donate()"))); ... unproven
33/55 ... [ETH_LEAK] line 300, selfdestruct(owner); ... unproven
34/55 ... [ETH_LEAK] line 307, winner.transfer(ethToTransfer); ... unproven
35/55 ... [ETH_LEAK] line 318, requester.transfer(ethToTransfer); ... unproven
36/55 ... [ETH_LEAK] line 329, success = paidUser.send(amount); ... unproven
37/55 ... [RE_EL] line 155, whale.call.value(donate_amount)(bytes4(keccak256("donate()"))); ... unproven
38/55 ... [RE_EL] line 307, winner.transfer(ethToTransfer); ... unproven
39/55 ... [RE_EL] line 318, requester.transfer(ethToTransfer); ... unproven
40/55 ... [RE_EL] line 329, success = paidUser.send(amount); ... unproven
41/55 ... [RE] line 113, (FiftyFlip, setBotAddress, [address]) ... unproven
42/55 ... [RE] line 120, (FiftyFlip, setSecretSigner, [address]) ... unproven
43/55 ... [RE] line 128, (FiftyFlip, wager, [bool, uint256, uint256, uint8, bytes32, bytes32]) ... unproven
44/55 ... [RE] line 167, (FiftyFlip, play, [uint256]) ... unproven
45/55 ... [RE] line 214, (FiftyFlip, donateForContractHealth, []) ... unproven
46/55 ... [RE] line 222, (FiftyFlip, withdrawDonation, [uint256]) ... unproven
47/55 ... [RE] line 244, (FiftyFlip, withdrawDevFee, [address, uint256]) ... unproven
48/55 ... [RE] line 257, (FiftyFlip, withdrawBotFee, [uint256]) ... unproven
49/55 ... [RE] line 312, (FiftyFlip, sendRefund, [uint256]) ... unproven
50/55 ... [RE] line 345, (FiftyFlip, clearStorage, [uint256[]]) ... unproven
51/55 ... [TX_ORG] line 93, assume((msg.sender == owner)); ... proven
52/55 ... [TX_ORG] line 98, assume((msg.sender == autoPlayBot)); ... proven
53/55 ... [TX_ORG] line 135, assume((bet.player == address(0))); ... proven
54/55 ... [TX_ORG] line 142, assume((secretSigner == ecrecover(signatureHash, v, r, s))); ... proven
55/55 ... [TX_ORG] line 173, assume((bet.player != address(0))); ... proven
took 41.133009s

Generating VCs ... took 0.241273s
Checking validity of VCs ... took 0.207939s

Generating VCs ... took 0.244541s
Checking validity of VCs ... 
=============== Invariants Found ===============
Iter: 3 Total elapsed : 57.976509
[
-1 -> (Read(@TU, owner__@27) == true)
0 -> (Read(@TU, owner__@27) == true)
517 -> (Read(@TU, owner__@27) == true)
(-1,517) -> (Read(@TU, owner__@27) == true)
]
[
]
1/55 ... [IO] line 103, ((lockedInBets + jackpotSize) + devFeeSize) ... unproven
2/55 ... [IO] line 103, (lockedInBets + jackpotSize) ... unproven
3/55 ... [IO] line 138, (2 * amount) ... unproven
4/55 ... [IO] line 144, (amount * JACKPOT_FEE) ... unproven
5/55 ... [IO] line 144, (jackpotSize + ((amount * JACKPOT_FEE) / 1000)) ... unproven
6/55 ... [IO] line 145, (amount * DEV_FEE) ... unproven
7/55 ... [IO] line 145, (devFeeSize + ((amount * DEV_FEE) / 1000)) ... unproven
8/55 ... [IO] line 146, (amount * WIN_X) ... unproven
9/55 ... [IO] line 146, (lockedInBets + ((amount * WIN_X) / 1000)) ... unproven
10/55 ... [IO] line 148, (amount * DONATING_X) ... unproven
11/55 ... [IO] line 150, (totalAmountToWhale + donate_amount) ... unproven
12/55 ... [IO] line 176, (block.number - BET_EXPIRATION_BLOCKS) ... proven
13/55 ... [IO] line 182, (bet.amount * WIN_X) ... unproven
14/55 ... [IO] line 197, (tossWin + jackpotWin) ... unproven
15/55 ... [IO] line 199, (tossWin + jackpotWin) ... unproven
16/55 ... [IO] line 205, (lockedInBets - tossWinAmount) ... unproven
17/55 ... [IO] line 218, (donateAmount[msg.sender] + msg.value) ... unproven
18/55 ... [IO] line 228, (donateAmount[msg.sender] - amount) ... proven
19/55 ... [IO] line 239, (bet.blockNumber + BET_EXPIRATION_BLOCKS) ... unproven
20/55 ... [IO] line 252, (devFeeSize - withdrawAmount) ... proven
21/55 ... [IO] line 265, (devFeeSize - withdrawAmount) ... proven
22/55 ... [IO] line 291, ((lockedInBets + jackpotSize) + devFeeSize) ... unproven
23/55 ... [IO] line 291, (lockedInBets + jackpotSize) ... unproven
24/55 ... [IO] line 292, (((address(this).balance - lockedInBets) - jackpotSize) - devFeeSize) ... unproven
25/55 ... [IO] line 292, ((address(this).balance - lockedInBets) - jackpotSize) ... unproven
26/55 ... [IO] line 292, (address(this).balance - lockedInBets) ... unproven
27/55 ... [IO] line 320, (bet.amount * WIN_X) ... unproven
28/55 ... [IO] line 321, (lockedInBets - tossWinAmount) ... unproven
29/55 ... [IO] line 348, (i + 1) ... proven
30/55 ... [IO] line 359, (bet.blockNumber + BET_EXPIRATION_BLOCKS) ... unproven
31/55 ... [KA] line 300, selfdestruct(owner); ... proven
32/55 ... [ETH_LEAK] line 155, whale.call.value(donate_amount)(bytes4(keccak256("donate()"))); ... unproven
33/55 ... [ETH_LEAK] line 300, selfdestruct(owner); ... proven
34/55 ... [ETH_LEAK] line 307, winner.transfer(ethToTransfer); ... unproven
35/55 ... [ETH_LEAK] line 318, requester.transfer(ethToTransfer); ... unproven
36/55 ... [ETH_LEAK] line 329, success = paidUser.send(amount); ... unproven
37/55 ... [RE_EL] line 155, whale.call.value(donate_amount)(bytes4(keccak256("donate()"))); ... unproven
38/55 ... [RE_EL] line 307, winner.transfer(ethToTransfer); ... unproven
39/55 ... [RE_EL] line 318, requester.transfer(ethToTransfer); ... unproven
40/55 ... [RE_EL] line 329, success = paidUser.send(amount); ... unproven
41/55 ... [RE] line 113, (FiftyFlip, setBotAddress, [address]) ... proven
42/55 ... [RE] line 120, (FiftyFlip, setSecretSigner, [address]) ... proven
43/55 ... [RE] line 128, (FiftyFlip, wager, [bool, uint256, uint256, uint8, bytes32, bytes32]) ... unproven
44/55 ... [RE] line 167, (FiftyFlip, play, [uint256]) ... unproven
45/55 ... [RE] line 214, (FiftyFlip, donateForContractHealth, []) ... unproven
46/55 ... [RE] line 222, (FiftyFlip, withdrawDonation, [uint256]) ... unproven
47/55 ... [RE] line 244, (FiftyFlip, withdrawDevFee, [address, uint256]) ... proven
48/55 ... [RE] line 257, (FiftyFlip, withdrawBotFee, [uint256]) ... unproven
49/55 ... [RE] line 312, (FiftyFlip, sendRefund, [uint256]) ... unproven
50/55 ... [RE] line 345, (FiftyFlip, clearStorage, [uint256[]]) ... unproven
51/55 ... [TX_ORG] line 93, assume((msg.sender == owner)); ... proven
52/55 ... [TX_ORG] line 98, assume((msg.sender == autoPlayBot)); ... proven
53/55 ... [TX_ORG] line 135, assume((bet.player == address(0))); ... proven
54/55 ... [TX_ORG] line 142, assume((secretSigner == ecrecover(signatureHash, v, r, s))); ... proven
55/55 ... [TX_ORG] line 173, assume((bet.player != address(0))); ... proven
took 35.128655s

Generating VCs ... took 0.257944s
Checking validity of VCs ... 
=============== Invariants Found ===============
Iter: 4 Total elapsed : 114.245853
[
-1 -> ((Read(@TU, autoPlayBot__@29) == true) /\ (Read(@TU, owner__@27) == true))
0 -> ((Read(@TU, autoPlayBot__@29) == true) /\ (Read(@TU, owner__@27) == true))
517 -> ((Read(@TU, autoPlayBot__@29) == true) /\ (Read(@TU, owner__@27) == true))
(-1,517) -> ((Read(@TU, autoPlayBot__@29) == true) /\ (Read(@TU, owner__@27) == true))
]
[
]
1/55 ... [IO] line 103, ((lockedInBets + jackpotSize) + devFeeSize) ... unproven
2/55 ... [IO] line 103, (lockedInBets + jackpotSize) ... unproven
3/55 ... [IO] line 138, (2 * amount) ... unproven
4/55 ... [IO] line 144, (amount * JACKPOT_FEE) ... unproven
5/55 ... [IO] line 144, (jackpotSize + ((amount * JACKPOT_FEE) / 1000)) ... unproven
6/55 ... [IO] line 145, (amount * DEV_FEE) ... unproven
7/55 ... [IO] line 145, (devFeeSize + ((amount * DEV_FEE) / 1000)) ... unproven
8/55 ... [IO] line 146, (amount * WIN_X) ... unproven
9/55 ... [IO] line 146, (lockedInBets + ((amount * WIN_X) / 1000)) ... unproven
10/55 ... [IO] line 148, (amount * DONATING_X) ... unproven
11/55 ... [IO] line 150, (totalAmountToWhale + donate_amount) ... unproven
12/55 ... [IO] line 176, (block.number - BET_EXPIRATION_BLOCKS) ... proven
13/55 ... [IO] line 182, (bet.amount * WIN_X) ... unproven
14/55 ... [IO] line 197, (tossWin + jackpotWin) ... unproven
15/55 ... [IO] line 199, (tossWin + jackpotWin) ... unproven
16/55 ... [IO] line 205, (lockedInBets - tossWinAmount) ... unproven
17/55 ... [IO] line 218, (donateAmount[msg.sender] + msg.value) ... unproven
18/55 ... [IO] line 228, (donateAmount[msg.sender] - amount) ... proven
19/55 ... [IO] line 239, (bet.blockNumber + BET_EXPIRATION_BLOCKS) ... unproven
20/55 ... [IO] line 252, (devFeeSize - withdrawAmount) ... proven
21/55 ... [IO] line 265, (devFeeSize - withdrawAmount) ... proven
22/55 ... [IO] line 291, ((lockedInBets + jackpotSize) + devFeeSize) ... unproven
23/55 ... [IO] line 291, (lockedInBets + jackpotSize) ... unproven
24/55 ... [IO] line 292, (((address(this).balance - lockedInBets) - jackpotSize) - devFeeSize) ... unproven
25/55 ... [IO] line 292, ((address(this).balance - lockedInBets) - jackpotSize) ... unproven
26/55 ... [IO] line 292, (address(this).balance - lockedInBets) ... unproven
27/55 ... [IO] line 320, (bet.amount * WIN_X) ... unproven
28/55 ... [IO] line 321, (lockedInBets - tossWinAmount) ... unproven
29/55 ... [IO] line 348, (i + 1) ... proven
30/55 ... [IO] line 359, (bet.blockNumber + BET_EXPIRATION_BLOCKS) ... unproven
31/55 ... [KA] line 300, selfdestruct(owner); ... proven
32/55 ... [ETH_LEAK] line 155, whale.call.value(donate_amount)(bytes4(keccak256("donate()"))); ... unproven
33/55 ... [ETH_LEAK] line 300, selfdestruct(owner); ... proven
34/55 ... [ETH_LEAK] line 307, winner.transfer(ethToTransfer); ... unproven
35/55 ... [ETH_LEAK] line 318, requester.transfer(ethToTransfer); ... unproven
36/55 ... [ETH_LEAK] line 329, success = paidUser.send(amount); ... unproven
37/55 ... [RE_EL] line 155, whale.call.value(donate_amount)(bytes4(keccak256("donate()"))); ... unproven
38/55 ... [RE_EL] line 307, winner.transfer(ethToTransfer); ... unproven
39/55 ... [RE_EL] line 318, requester.transfer(ethToTransfer); ... unproven
40/55 ... [RE_EL] line 329, success = paidUser.send(amount); ... unproven
41/55 ... [RE] line 113, (FiftyFlip, setBotAddress, [address]) ... proven
42/55 ... [RE] line 120, (FiftyFlip, setSecretSigner, [address]) ... proven
43/55 ... [RE] line 128, (FiftyFlip, wager, [bool, uint256, uint256, uint8, bytes32, bytes32]) ... unproven
44/55 ... [RE] line 167, (FiftyFlip, play, [uint256]) ... unproven
45/55 ... [RE] line 214, (FiftyFlip, donateForContractHealth, []) ... unproven
46/55 ... [RE] line 222, (FiftyFlip, withdrawDonation, [uint256]) ... unproven
47/55 ... [RE] line 244, (FiftyFlip, withdrawDevFee, [address, uint256]) ... proven
48/55 ... [RE] line 257, (FiftyFlip, withdrawBotFee, [uint256]) ... proven
49/55 ... [RE] line 312, (FiftyFlip, sendRefund, [uint256]) ... unproven
50/55 ... [RE] line 345, (FiftyFlip, clearStorage, [uint256[]]) ... unproven
51/55 ... [TX_ORG] line 93, assume((msg.sender == owner)); ... proven
52/55 ... [TX_ORG] line 98, assume((msg.sender == autoPlayBot)); ... proven
53/55 ... [TX_ORG] line 135, assume((bet.player == address(0))); ... proven
54/55 ... [TX_ORG] line 142, assume((secretSigner == ecrecover(signatureHash, v, r, s))); ... proven
55/55 ... [TX_ORG] line 173, assume((bet.player != address(0))); ... proven
took 40.733404s

Generating VCs ... took 0.032106s
Checking validity of VCs ... 
1/79 ... [NO_EFFECT] line 117, (@pre1 == autoPlayBot) ... unproven
2/79 ... [NO_EFFECT] line 124, (@pre2 == secretSigner) ... unproven
3/79 ... [NO_EFFECT] line 133, (@pre12 == amount) ... unproven
4/79 ... [NO_EFFECT] line 134, (@pre11 == player) ... unproven
5/79 ... [NO_EFFECT] line 144, (@pre10 == jackpotSize) ... unproven
6/79 ... [NO_EFFECT] line 145, (@pre9 == devFeeSize) ... unproven
7/79 ... [NO_EFFECT] line 146, (@pre8 == lockedInBets) ... unproven
8/79 ... [NO_EFFECT] line 148, (@pre7 == donate_amount) ... unproven
9/79 ... [NO_EFFECT] line 150, (@pre6 == totalAmountToWhale) ... unproven
10/79 ... [NO_EFFECT] line 151, (@pre5 == bet.amount) ... unproven
11/79 ... [NO_EFFECT] line 152, (@pre4 == bet.blockNumber) ... unproven
12/79 ... [NO_EFFECT] line 154, (@pre3 == bet.player) ... unproven
13/79 ... [NO_EFFECT] line 171, (@pre20 == ticketID) ... unproven
14/79 ... [NO_EFFECT] line 175, (@pre19 == blockNumber) ... unproven
15/79 ... [NO_EFFECT] line 178, (@pre18 == random) ... unproven
16/79 ... [NO_EFFECT] line 180, (@pre17 == jackpotRes) ... unproven
17/79 ... [NO_EFFECT] line 182, (@pre16 == tossWinAmount) ... unproven
18/79 ... [NO_EFFECT] line 188, (@pre15 == tossWin) ... unproven
19/79 ... [NO_EFFECT] line 191, (@pre14 == jackpotWin) ... unproven
20/79 ... [NO_EFFECT] line 205, (@pre13 == lockedInBets) ... unproven
21/79 ... [NO_EFFECT] line 218, (@pre21 == donateAmount[msg.sender]) ... unproven
22/79 ... [NO_EFFECT] line 228, (@pre22 == donateAmount[msg.sender]) ... unproven
23/79 ... [NO_EFFECT] line 252, (@pre23 == devFeeSize) ... unproven
24/79 ... [NO_EFFECT] line 265, (@pre24 == devFeeSize) ... unproven
25/79 ... [NO_EFFECT] line 316, (@pre28 == requester) ... unproven
26/79 ... [NO_EFFECT] line 317, (@pre27 == ethToTransfer) ... unproven
27/79 ... [NO_EFFECT] line 320, (@pre26 == tossWinAmount) ... unproven
28/79 ... [NO_EFFECT] line 321, (@pre25 == lockedInBets) ... unproven
29/79 ... [NO_EFFECT] line 346, (@pre30 == length) ... unproven
30/79 ... [NO_EFFECT] line 348, (@pre29 == i) ... unproven
31/79 ... [NO_EFFECT] line 365, (@pre31 == bet.player) ... unproven
32/79 ... [ASSIGN_CONST] line 144, (jackpotSize == 0) ... unproven
33/79 ... [ASSIGN_CONST] line 145, (devFeeSize == 0) ... unproven
34/79 ... [ASSIGN_CONST] line 146, (lockedInBets == 0) ... unproven
35/79 ... [ASSIGN_CONST] line 150, (totalAmountToWhale == 0) ... unproven
36/79 ... [ASSIGN_CONST] line 205, (lockedInBets == 0) ... unproven
37/79 ... [ASSIGN_CONST] line 218, (donateAmount[msg.sender] == 0) ... unproven
38/79 ... [ASSIGN_CONST] line 228, (donateAmount[msg.sender] == 0) ... unproven
39/79 ... [ASSIGN_CONST] line 252, (devFeeSize == 0) ... unproven
40/79 ... [ASSIGN_CONST] line 265, (devFeeSize == 0) ... unproven
41/79 ... [ASSIGN_CONST] line 321, (lockedInBets == 0) ... unproven
42/79 ... [ASSIGN_CONST] line 348, (i == 0) ... unproven
43/79 ... [DEAD] line 93, false ... unproven
44/79 ... [DEAD] line 98, false ... unproven
45/79 ... [DEAD] line 103, false ... unproven
46/79 ... [DEAD] line 135, false ... unproven
47/79 ... [DEAD] line 136, false ... unproven
48/79 ... [DEAD] line 137, false ... unproven
49/79 ... [DEAD] line 138, false ... unproven
50/79 ... [DEAD] line 140, false ... unproven
51/79 ... [DEAD] line 142, false ... unproven
52/79 ... [DEAD] line 173, false ... unproven
53/79 ... [DEAD] line 174, false ... unproven
54/79 ... [DEAD] line 176, false ... unproven
55/79 ... [DEAD] line 187, false ... unproven
56/79 ... [DEAD] line 190, false ... unproven
57/79 ... [DEAD] line 194, false ... unproven
58/79 ... [DEAD] line 197, false ... unproven
59/79 ... [DEAD] line 199, false ... unproven
60/79 ... [DEAD] line 203, false ... unproven
61/79 ... [DEAD] line 225, false ... unproven
62/79 ... [DEAD] line 227, false ... unproven
63/79 ... [DEAD] line 238, false ... unproven
64/79 ... [DEAD] line 239, false ... unproven
65/79 ... [DEAD] line 240, false ... unproven
66/79 ... [DEAD] line 248, false ... unproven
67/79 ... [DEAD] line 249, false ... unproven
68/79 ... [DEAD] line 250, false ... unproven
69/79 ... [DEAD] line 251, false ... unproven
70/79 ... [DEAD] line 261, false ... unproven
71/79 ... [DEAD] line 262, false ... unproven
72/79 ... [DEAD] line 263, false ... unproven
73/79 ... [DEAD] line 264, false ... unproven
74/79 ... [DEAD] line 291, false ... unproven
75/79 ... [DEAD] line 299, false ... unproven
76/79 ... [DEAD] line 307, false ... unproven
77/79 ... [DEAD] line 318, false ... unproven
78/79 ... [DEAD] line 349, false ... unproven
79/79 ... [DEAD] line 359, false ... unproven
took 12.278317s


===== Vulnerability Report =====
[1] [IO] line 103, ((lockedInBets + jackpotSize) + devFeeSize) : unproven
[2] [IO] line 103, (lockedInBets + jackpotSize) : unproven
[3] [IO] line 138, (2 * amount) : unproven
[4] [IO] line 144, (amount * JACKPOT_FEE) : unproven
[5] [IO] line 144, (jackpotSize + ((amount * JACKPOT_FEE) / 1000)) : unproven
[6] [IO] line 145, (amount * DEV_FEE) : unproven
[7] [IO] line 145, (devFeeSize + ((amount * DEV_FEE) / 1000)) : unproven
[8] [IO] line 146, (amount * WIN_X) : unproven
[9] [IO] line 146, (lockedInBets + ((amount * WIN_X) / 1000)) : unproven
[10] [IO] line 148, (amount * DONATING_X) : unproven
[11] [IO] line 150, (totalAmountToWhale + donate_amount) : unproven
[12] [IO] line 176, (block.number - BET_EXPIRATION_BLOCKS) : proven
[13] [IO] line 182, (bet.amount * WIN_X) : unproven
[14] [IO] line 197, (tossWin + jackpotWin) : unproven
[15] [IO] line 199, (tossWin + jackpotWin) : unproven
[16] [IO] line 205, (lockedInBets - tossWinAmount) : unproven
[17] [IO] line 218, (donateAmount[msg.sender] + msg.value) : unproven
[18] [IO] line 228, (donateAmount[msg.sender] - amount) : proven
[19] [IO] line 239, (bet.blockNumber + BET_EXPIRATION_BLOCKS) : unproven
[20] [IO] line 252, (devFeeSize - withdrawAmount) : proven
[21] [IO] line 265, (devFeeSize - withdrawAmount) : proven
[22] [IO] line 291, ((lockedInBets + jackpotSize) + devFeeSize) : unproven
[23] [IO] line 291, (lockedInBets + jackpotSize) : unproven
[24] [IO] line 292, (((address(this).balance - lockedInBets) - jackpotSize) - devFeeSize) : unproven
[25] [IO] line 292, ((address(this).balance - lockedInBets) - jackpotSize) : unproven
[26] [IO] line 292, (address(this).balance - lockedInBets) : unproven
[27] [IO] line 320, (bet.amount * WIN_X) : unproven
[28] [IO] line 321, (lockedInBets - tossWinAmount) : unproven
[29] [IO] line 348, (i + 1) : proven
[30] [IO] line 359, (bet.blockNumber + BET_EXPIRATION_BLOCKS) : unproven
[31] [KA] line 300, selfdestruct(owner); : proven
[32] [ETH_LEAK] line 155, whale.call.value(donate_amount)(bytes4(keccak256("donate()"))); : unproven
[33] [ETH_LEAK] line 300, selfdestruct(owner); : proven
[34] [ETH_LEAK] line 307, winner.transfer(ethToTransfer); : unproven
[35] [ETH_LEAK] line 318, requester.transfer(ethToTransfer); : unproven
[36] [ETH_LEAK] line 329, success = paidUser.send(amount); : unproven
[37] [RE_EL] line 155, whale.call.value(donate_amount)(bytes4(keccak256("donate()"))); : unproven
[38] [RE_EL] line 307, winner.transfer(ethToTransfer); : unproven
[39] [RE_EL] line 318, requester.transfer(ethToTransfer); : unproven
[40] [RE_EL] line 329, success = paidUser.send(amount); : unproven
[41] [RE] line 113, (FiftyFlip, setBotAddress, [address]) : proven
[42] [RE] line 120, (FiftyFlip, setSecretSigner, [address]) : proven
[43] [RE] line 128, (FiftyFlip, wager, [bool, uint256, uint256, uint8, bytes32, bytes32]) : unproven
[44] [RE] line 167, (FiftyFlip, play, [uint256]) : unproven
[45] [RE] line 214, (FiftyFlip, donateForContractHealth, []) : unproven
[46] [RE] line 222, (FiftyFlip, withdrawDonation, [uint256]) : unproven
[47] [RE] line 244, (FiftyFlip, withdrawDevFee, [address, uint256]) : proven
[48] [RE] line 257, (FiftyFlip, withdrawBotFee, [uint256]) : proven
[49] [RE] line 312, (FiftyFlip, sendRefund, [uint256]) : unproven
[50] [RE] line 345, (FiftyFlip, clearStorage, [uint256[]]) : unproven
[51] [TX_ORG] line 93, assume((msg.sender == owner)); : proven
[52] [TX_ORG] line 98, assume((msg.sender == autoPlayBot)); : proven
[53] [TX_ORG] line 135, assume((bet.player == address(0))); : proven
[54] [TX_ORG] line 142, assume((secretSigner == ecrecover(signatureHash, v, r, s))); : proven
[55] [TX_ORG] line 173, assume((bet.player != address(0))); : proven

===== Regression Report =====
[1] [NO_EFFECT] line 117, (@pre1 == autoPlayBot) : unproven
[2] [NO_EFFECT] line 124, (@pre2 == secretSigner) : unproven
[3] [NO_EFFECT] line 133, (@pre12 == amount) : unproven
[4] [NO_EFFECT] line 134, (@pre11 == player) : unproven
[5] [NO_EFFECT] line 144, (@pre10 == jackpotSize) : unproven
[6] [NO_EFFECT] line 145, (@pre9 == devFeeSize) : unproven
[7] [NO_EFFECT] line 146, (@pre8 == lockedInBets) : unproven
[8] [NO_EFFECT] line 148, (@pre7 == donate_amount) : unproven
[9] [NO_EFFECT] line 150, (@pre6 == totalAmountToWhale) : unproven
[10] [NO_EFFECT] line 151, (@pre5 == bet.amount) : unproven
[11] [NO_EFFECT] line 152, (@pre4 == bet.blockNumber) : unproven
[12] [NO_EFFECT] line 154, (@pre3 == bet.player) : unproven
[13] [NO_EFFECT] line 171, (@pre20 == ticketID) : unproven
[14] [NO_EFFECT] line 175, (@pre19 == blockNumber) : unproven
[15] [NO_EFFECT] line 178, (@pre18 == random) : unproven
[16] [NO_EFFECT] line 180, (@pre17 == jackpotRes) : unproven
[17] [NO_EFFECT] line 182, (@pre16 == tossWinAmount) : unproven
[18] [NO_EFFECT] line 188, (@pre15 == tossWin) : unproven
[19] [NO_EFFECT] line 191, (@pre14 == jackpotWin) : unproven
[20] [NO_EFFECT] line 205, (@pre13 == lockedInBets) : unproven
[21] [NO_EFFECT] line 218, (@pre21 == donateAmount[msg.sender]) : unproven
[22] [NO_EFFECT] line 228, (@pre22 == donateAmount[msg.sender]) : unproven
[23] [NO_EFFECT] line 252, (@pre23 == devFeeSize) : unproven
[24] [NO_EFFECT] line 265, (@pre24 == devFeeSize) : unproven
[25] [NO_EFFECT] line 316, (@pre28 == requester) : unproven
[26] [NO_EFFECT] line 317, (@pre27 == ethToTransfer) : unproven
[27] [NO_EFFECT] line 320, (@pre26 == tossWinAmount) : unproven
[28] [NO_EFFECT] line 321, (@pre25 == lockedInBets) : unproven
[29] [NO_EFFECT] line 346, (@pre30 == length) : unproven
[30] [NO_EFFECT] line 348, (@pre29 == i) : unproven
[31] [NO_EFFECT] line 365, (@pre31 == bet.player) : unproven
[32] [ASSIGN_CONST] line 144, (jackpotSize == 0) : unproven
[33] [ASSIGN_CONST] line 145, (devFeeSize == 0) : unproven
[34] [ASSIGN_CONST] line 146, (lockedInBets == 0) : unproven
[35] [ASSIGN_CONST] line 150, (totalAmountToWhale == 0) : unproven
[36] [ASSIGN_CONST] line 205, (lockedInBets == 0) : unproven
[37] [ASSIGN_CONST] line 218, (donateAmount[msg.sender] == 0) : unproven
[38] [ASSIGN_CONST] line 228, (donateAmount[msg.sender] == 0) : unproven
[39] [ASSIGN_CONST] line 252, (devFeeSize == 0) : unproven
[40] [ASSIGN_CONST] line 265, (devFeeSize == 0) : unproven
[41] [ASSIGN_CONST] line 321, (lockedInBets == 0) : unproven
[42] [ASSIGN_CONST] line 348, (i == 0) : unproven
[43] [DEAD] line 93, false : unproven
[44] [DEAD] line 98, false : unproven
[45] [DEAD] line 103, false : unproven
[46] [DEAD] line 135, false : unproven
[47] [DEAD] line 136, false : unproven
[48] [DEAD] line 137, false : unproven
[49] [DEAD] line 138, false : unproven
[50] [DEAD] line 140, false : unproven
[51] [DEAD] line 142, false : unproven
[52] [DEAD] line 173, false : unproven
[53] [DEAD] line 174, false : unproven
[54] [DEAD] line 176, false : unproven
[55] [DEAD] line 187, false : unproven
[56] [DEAD] line 190, false : unproven
[57] [DEAD] line 194, false : unproven
[58] [DEAD] line 197, false : unproven
[59] [DEAD] line 199, false : unproven
[60] [DEAD] line 203, false : unproven
[61] [DEAD] line 225, false : unproven
[62] [DEAD] line 227, false : unproven
[63] [DEAD] line 238, false : unproven
[64] [DEAD] line 239, false : unproven
[65] [DEAD] line 240, false : unproven
[66] [DEAD] line 248, false : unproven
[67] [DEAD] line 249, false : unproven
[68] [DEAD] line 250, false : unproven
[69] [DEAD] line 251, false : unproven
[70] [DEAD] line 261, false : unproven
[71] [DEAD] line 262, false : unproven
[72] [DEAD] line 263, false : unproven
[73] [DEAD] line 264, false : unproven
[74] [DEAD] line 291, false : unproven
[75] [DEAD] line 299, false : unproven
[76] [DEAD] line 307, false : unproven
[77] [DEAD] line 318, false : unproven
[78] [DEAD] line 349, false : unproven
[79] [DEAD] line 359, false : unproven

============ Statistics ============
# Iter                    : 4
# Alarm / Query           : 39 / 55
- integer over/underflow  : 25 / 30
- kill-anyone             : 0 / 1
- ether-leaking           : 4 / 5
- reentrancy-leaking      : 4 / 4
- reentrancy              : 6 / 10
- tx.origin               : 0 / 5

Time Elapsed (Real) : 185.810523987
Time Elapsed (CPU)  : 185.765782
